<?xml version="1.0"?>
<shapes xmlns:xsi="http://www.w3.org/2001/XMLSchema-instance"
        xsi:noNamespaceSchemaLocation="shapes.xsd">
	<settings id="simulationSettings">
		<delta-t  t="0.0005"  />
		<end-time t="25.0"   />
		<factor val="0.0"/>
        <domain-size x="63.0" y="36.0" z="0.0" />
        <rcutoff  val="3.0"            />
		<x1-boundary-condition val="reflecting"/>
		<x2-boundary-condition val="outflow"   />
		<y1-boundary-condition val="periodic"  />
		<y2-boundary-condition val="periodic"  />
		<z1-boundary-condition val="periodic"  />
		<z2-boundary-condition val="periodic"  />
		<brownian-motion bol="true" />
		<initial-temperature val="40.0" />
		<n-thermostat t="1000.0" />
		<target-temperature val="40.0" />
		<temperature-difference val="0.0" />
		<gravitation val="-12.44" />
		<r0 val="2.2"/>
		<k val="300.0"/>
		<fz-up val="0.8" />
		<parallelisation-method val = "sparse" />
		<force-calculation-method  val = "LJ"  />
	</settings>

	<checkpoint id="checkpointSettings">
		<write-checkpoint bol="true" />
		<read-checkpoint  bol="false" />
		<write-checkpoint-time t="5.0" />
	</checkpoint>

	<sphere id="sphere1">
		<type val="1.0" 						  />
		<epsilon val="5.0"                      />
		<sigma val="1.0"                        />
		<centre   x="10.0" y="0.0" z="0.0"        />
		<radius   val="5.0"                       />
		<velocity x="0.0" y="0.0" z="0.0"         />
		<mass 	  val="1.0" 	                  />
		<h		  val="1.025"                     />
	</sphere>

	<cuboid id="liquid1">
		<type val="3.0" />
		<epsilon val="1.0"/>
		<sigma val="1.0"/>
		<right-top-point   x="32.1" y="2.0" z="0.0"        />
		<side-lengths   x="50.0" y="14.0" z="1.0"               />
		<velocity x="0.0" y="0.0" z="0.0"         />
		<mass 	  val="1.0" 	                  />
		<h		  val="1.2"                     />
		<membrane bol="false" />
	</cuboid>

	<cuboid id="liquid2">
		<type val="2.0"/>
		<epsilon val="1.0"/>
		<sigma val="0.9412"/>
		<right-top-point   x="32.1" y="19.0" z="0.0"        />
		<side-lengths   x="50.0" y="14.0" z="1.0"               />
		<velocity x="0.0" y="0.0" z="0.0"         />
		<mass 	  val="2.0" 	                  />
		<h		  val="1.2"                     />
		<membrane bol="false" />
	</cuboid>

</shapes>
