<?xml version="1.0"?>
<shapes xmlns:xsi="http://www.w3.org/2001/XMLSchema-instance"
        xsi:noNamespaceSchemaLocation="shapes.xsd">
	<settings id="simulationSettings">
		<delta-t  t="0.0005"  />
		<end-time t="100.0"   />
		<factor val="0.0"/>
		<domain-size x="60.0" y="24.0" z="51.0" />
        <rcutoff  val="3.0"            />
		<x1-boundary-condition val="periodic"/>
		<x2-boundary-condition val="periodic"   />
		<y1-boundary-condition val="reflecting"  />
		<y2-boundary-condition val="reflecting"  />
		<z1-boundary-condition val="none"  />
		<z2-boundary-condition val="none"  />
		<brownian-motion bol="true" />
		<initial-temperature val="40.0" />
		<n-thermostat t="1000.0" />
		<target-temperature val="0.0" />
		<temperature-difference val="0.0" />
		<gravitation val="-12.44" />
		<r0 val="0.0"/>
		<k val="0.0"/>
		<fz-up val="0.0" />
		<parallelisation-method val = "sparse" />
		<force-calculation-method  val = "LJ"  />
		<rl val="0.0" />
	</settings>

	<checkpoint id="checkpointSettings">
		<write-checkpoint bol="false" 		     />
		<read-checkpoint  bol="false" 		     />
		<write-checkpoint-time t="0.0" 		     />
	</checkpoint>

	<cuboid id="liquid1">
		<type 	  	  val="1.0" 		     />
		<epsilon 	  val="2.0"		     />
		<sigma 		  val="1.15"		     />
		<right-top-point  x="0.6" y="0.6" z="0.6"    />
		<side-lengths     x="48.0" y="9.0" z="42.0"  />
		<velocity 	  x="0.0" y="0.0" z="0.0"    />
		<mass 	  	  val="14.0" 	             />
		<h		  	  val="1.2"                  />
		<membrane 	  bol="true" 		     />
	</cuboid>

	<cuboid id="liquid2">
		<type 	  	  val="2.0" 		     />
		<epsilon 	  val="2.0"		     />
		<sigma 		  val="1.15"		     />
		<right-top-point  x="0.6" y="11.4" z="0.6"    />
		<side-lengths     x="48.0" y="9.0" z="42.0"  />
		<velocity 	  x="0.0" y="0.0" z="0.0"    />
		<mass 	  	  val="30.0" 	             />
		<h		  	  val="1.2"                  />
		<membrane 	  bol="true" 		     />
	</cuboid>

</shapes>
